<?xml version="1.0" encoding="UTF-8"?>
<!DOCTYPE hechos SYSTEM '03.dtd'>

<hechos>
    <hechosHistoricos>
        <descripcion>Se funda Youtube</descripcion>
        <fecha>
            <dia>15</dia>
            <mes>2</mes>
            <anyo>2005</anyo>
        </fecha>
    </hechosHistoricos>
    <hechosHistoricos>
        <descripcion>Se funda Google</descripcion>
        <fecha>
            <dia>4</dia>
            <mes>9</mes>
            <anyo>1998</anyo>
        </fecha>
    </hechosHistoricos>
    <hechosHistoricos>
        <descripcion>Se funda Facebook</descripcion>
        <fecha>
            <dia>4</dia>
            <mes>2</mes>
            <anyo>2004</anyo>
        </fecha>
    </hechosHistoricos>
</hechos>